{
  "storeName": "TechGear Pro",
  "tagline": "Your destination for premium tech accessories",
  "currency": "USD",
  "showBanner": true,
  "bannerText": "Summer Sale - Up to 30% off!",
  "discountPercent": 15,
  "products": [
    {
      "id": "WH-1000",
      "name": "Wireless Headphones Pro",
      "description": "Premium noise-canceling wireless headphones with 30-hour battery life",
      "price": 249.99,
      "originalPrice": 299.99,
      "inStock": true,
      "stockCount": 45,
      "category": "Audio",
      "tags": ["wireless", "noise-canceling", "premium"],
      "rating": 4.8,
      "reviewCount": 1247
    },
    {
      "id": "KB-2500",
      "name": "Mechanical Keyboard RGB",
      "description": "Full-size mechanical keyboard with customizable RGB backlighting",
      "price": 129.99,
      "originalPrice": 149.99,
      "inStock": true,
      "stockCount": 23,
      "category": "Peripherals",
      "tags": ["mechanical", "rgb", "gaming"],
      "rating": 4.6,
      "reviewCount": 892
    },
    {
      "id": "MS-3200",
      "name": "Ergonomic Mouse",
      "description": "Vertical ergonomic mouse designed for all-day comfort",
      "price": 79.99,
      "inStock": true,
      "stockCount": 67,
      "category": "Peripherals",
      "tags": ["ergonomic", "wireless"],
      "rating": 4.4,
      "reviewCount": 456
    },
    {
      "id": "CH-4100",
      "name": "USB-C Hub 7-in-1",
      "description": "Compact USB-C hub with HDMI, USB-A, SD card reader, and ethernet",
      "price": 59.99,
      "originalPrice": 69.99,
      "inStock": false,
      "stockCount": 0,
      "category": "Accessories",
      "tags": ["usb-c", "hub", "portable"],
      "rating": 4.5,
      "reviewCount": 678
    },
    {
      "id": "MT-5000",
      "name": "Laptop Stand Adjustable",
      "description": "Aluminum laptop stand with adjustable height and angle",
      "price": 49.99,
      "inStock": true,
      "stockCount": 5,
      "category": "Accessories",
      "tags": ["aluminum", "adjustable", "ergonomic"],
      "rating": 4.7,
      "reviewCount": 234
    }
  ],
  "featuredCategories": ["Audio", "Peripherals", "Accessories"],
  "contactEmail": "support@techgearpro.com"
}
